{
  "id": "auto-f2p-438100",
  "gameTitle": "VRChat",
  "type": "permanent",
  "platform": "steam",
  "url": "https://store.steampowered.com/app/438100/",
  "claimNote": "免费开玩 · Steam 在玩人数前 100",
  "claimNoteEn": "Free to play · in Steam’s top 100 by players",
  "steamAppId": "438100",
  "checkedAt": "2026-11-01",
  "linkHealth": "ok",
  "note": "来自 Steam 官方「当前最多人玩」榜单，自动更新；游戏内可能有付费内容",
  "createdAt": "2026-10-28",
  "updatedAt": "2026-11-01",
  "publishStatus": "published"
}
