{
  "id": "auto-gp-3322",
  "gameTitle": "Sausage Hunter",
  "type": "limited",
  "platform": "indiegala",
  "url": "https://freebies.indiegala.com/sausage-hunter",
  "checkedAt": "2026-10-30",
  "linkHealth": "ok",
  "createdAt": "2026-10-27",
  "updatedAt": "2026-10-30",
  "publishStatus": "published",
  "claimNote": "IndieGala 免费领取，需要 IndieGala 账号，无 DRM 下载",
  "claimNoteEn": "Free on IndieGala (account needed), DRM-free download",
  "art": {
    "wide": "https://www.gamerpower.com/offers/1b/68eadb2d6f0c4.jpg"
  },
  "note": "由 GamerPower 赠送汇总发现，链接直达 IndieGala官方页面；截止时间仅供参考，以活动页为准"
}
