{
  "id": "auto-gp-3822",
  "gameTitle": "Terraspace",
  "type": "limited",
  "platform": "epic",
  "url": "https://store.epicgames.com/p/dimond-hunt-03a766",
  "checkedAt": "2026-10-27",
  "linkHealth": "ok",
  "createdAt": "2026-10-27",
  "updatedAt": "2026-10-27",
  "publishStatus": "published",
  "claimNote": "Epic 限时免费，领取后永久保留在库中",
  "endDate": "2026-10-27T23:59:00.000Z",
  "art": {
    "wide": "https://www.gamerpower.com/offers/1b/6ad9256e3eef5.jpg"
  },
  "note": "由 GamerPower 赠送汇总发现，链接直达官方页面；截止时间仅供参考，以活动页为准"
}
