{
  "id": "auto-gp-3421",
  "gameTitle": "Very Realistic Game Dev Simulator",
  "type": "limited",
  "platform": "itch",
  "url": "https://worsteventgames.itch.io/very-realistic-game-dev-simulator",
  "checkedAt": "2026-10-31",
  "linkHealth": "ok",
  "createdAt": "2026-10-29",
  "updatedAt": "2026-10-31",
  "publishStatus": "published",
  "claimNote": "itch.io 限时免费，领取后加入你的 itch.io 库",
  "claimNoteEn": "Free on itch.io for a limited time — add it to your library",
  "endDate": "2026-11-05T23:59:35.000Z",
  "art": {
    "wide": "https://www.gamerpower.com/offers/1b/6946b7c157bca.jpg"
  },
  "note": "由 GamerPower 赠送汇总发现，链接直达官方页面；截止时间仅供参考，以活动页为准"
}
