{
  "id": "auto-epic-flotsam-266287-20261105",
  "gameTitle": "浮游世界",
  "titleZh": "浮游世界",
  "type": "limited",
  "platform": "epic",
  "url": "https://store.epicgames.com/zh-CN/p/flotsam-266287",
  "claimNote": "Epic 下一期每周限免（已公布）",
  "claimNoteEn": "Next Epic weekly freebie (announced)",
  "startDate": "2026-11-05T16:00:00.000Z",
  "endDate": "2026-11-12T16:00:00.000Z",
  "checkedAt": "2026-11-02",
  "linkHealth": "ok",
  "note": "来自 Epic 官方免费游戏接口，自动更新；截止时间以 Epic 页面为准",
  "art": {
    "wide": "https://cdn1.epicgames.com/spt-assets/5c36b876e80d4285b9993947efeeaf2b/flotsam-1yczl.jpg",
    "tall": "https://cdn1.epicgames.com/spt-assets/5c36b876e80d4285b9993947efeeaf2b/flotsam-12rh8.jpg"
  },
  "createdAt": "2026-10-30",
  "updatedAt": "2026-11-02",
  "publishStatus": "published"
}
