{
  "id": "valorant-free",
  "gameTitle": "VALORANT 无畏契约",
  "titleZh": "无畏契约",
  "type": "permanent",
  "platform": "official",
  "url": "https://val.qq.com/",
  "claimNote": "免费开玩 · 国服由腾讯运营，通过 WeGame 或官网客户端启动",
  "checkedAt": "2026-10-28",
  "linkHealth": "ok",
  "note": "人工整理：不在 Steam 上的热门免费游戏，链接到官方网站 / 官方商店页",
  "createdAt": "2026-10-28",
  "updatedAt": "2026-10-28",
  "publishStatus": "published",
  "claimNoteEn": "Free to play · China server run by Tencent; launch via WeGame or the official client"
}
