{
  "id": "fortnite-free",
  "gameTitle": "Fortnite 堡垒之夜",
  "titleZh": "堡垒之夜",
  "type": "permanent",
  "platform": "epic",
  "url": "https://store.epicgames.com/zh-CN/p/fortnite",
  "claimNote": "免费开玩 · Epic 启动器，内购外观与通行证",
  "checkedAt": "2026-10-28",
  "linkHealth": "ok",
  "note": "人工整理：不在 Steam 上的热门免费游戏，链接到官方网站 / 官方商店页",
  "createdAt": "2026-10-28",
  "updatedAt": "2026-10-28",
  "publishStatus": "published",
  "claimNoteEn": "Free to play · Epic launcher; cosmetics and pass for sale"
}
