{
  "id": "auto-gp-3820",
  "gameTitle": "GetHigh.EXE",
  "type": "limited",
  "platform": "epic",
  "url": "https://store.epicgames.com/p/gethighexe-c83d1f",
  "checkedAt": "2026-10-31",
  "linkHealth": "ok",
  "createdAt": "2026-10-27",
  "updatedAt": "2026-10-31",
  "publishStatus": "published",
  "claimNote": "Epic 限时免费，领取后永久保留在库中",
  "claimNoteEn": "Free on Epic for a limited time — yours to keep",
  "endDate": "2026-11-02T23:59:00.000Z",
  "art": {
    "wide": "https://www.gamerpower.com/offers/1b/6ad63cd807641.jpg"
  },
  "note": "由 GamerPower 赠送汇总发现，链接直达官方页面；截止时间仅供参考，以活动页为准"
}
