{
  "id": "unciv-oss",
  "gameTitle": "Unciv",
  "type": "opensource",
  "platform": "official",
  "url": "https://yairm210.github.io/Unciv/",
  "claimNote": "开源回合制策略，《文明 5》风格的轻量重制",
  "checkedAt": "2026-10-28",
  "linkHealth": "ok",
  "note": "人工整理：开源免费游戏，链接到官方网站或官方商店页",
  "createdAt": "2026-10-28",
  "updatedAt": "2026-10-28",
  "publishStatus": "published",
  "claimNoteEn": "Open-source turn-based strategy, a lightweight Civilization V-style remake"
}
