{
  "id": "starrail-free",
  "gameTitle": "Honkai: Star Rail 崩坏：星穹铁道",
  "titleZh": "崩坏：星穹铁道",
  "type": "permanent",
  "platform": "official",
  "url": "https://sr.mihoyo.com/",
  "claimNote": "免费开玩 · 米哈游官网或 Epic 下载，内购抽卡",
  "checkedAt": "2026-10-28",
  "linkHealth": "ok",
  "note": "人工整理：不在 Steam 上的热门免费游戏，链接到官方网站 / 官方商店页",
  "createdAt": "2026-10-28",
  "updatedAt": "2026-10-28",
  "publishStatus": "published",
  "art": {
    "wide": "https://fastcdn.mihoyo.com/mi18n/hkrpg_cn/m20260904hy5hcii9ds/upload/3a30c5fc3b77912300cb38ca57c162b3_2025676058581400708.png"
  },
  "claimNoteEn": "Free to play · from HoYoverse or Epic; gacha purchases"
}
