{
  "id": "auto-epic-sker-ritual-aac702-20261022",
  "gameTitle": "Sker Ritual",
  "type": "limited",
  "platform": "epic",
  "url": "https://store.epicgames.com/zh-CN/p/sker-ritual-aac702",
  "claimNote": "Epic 每周限免，领取后永久保留在库中",
  "startDate": "2026-10-22T15:00:00.000Z",
  "endDate": "2026-10-29T15:00:00.000Z",
  "checkedAt": "2026-10-27",
  "linkHealth": "ok",
  "note": "来自 Epic 官方免费游戏接口，自动更新；截止时间以 Epic 页面为准",
  "art": {
    "wide": "https://cdn1.epicgames.com/spt-assets/43d96f4437e34c87b7eff08831d1b1de/sker-ritual-1tuka.png",
    "tall": "https://cdn1.epicgames.com/spt-assets/43d96f4437e34c87b7eff08831d1b1de/sker-ritual-1cyza.png"
  },
  "createdAt": "2026-10-27",
  "updatedAt": "2026-10-27",
  "publishStatus": "published"
}
