{
  "id": "warframe-free",
  "gameTitle": "Warframe 星际战甲",
  "titleZh": "星际战甲",
  "type": "permanent",
  "platform": "steam",
  "url": "https://store.steampowered.com/app/230410/Warframe/",
  "claimNote": "免费游玩，内购外观与加速项",
  "checkedAt": "2026-10-24",
  "linkHealth": "ok",
  "createdAt": "2026-10-24",
  "updatedAt": "2026-10-24",
  "publishStatus": "published"
}
