{
  "id": "crossfire-free",
  "gameTitle": "CrossFire 穿越火线",
  "titleZh": "穿越火线",
  "type": "permanent",
  "platform": "official",
  "url": "https://cf.qq.com/",
  "claimNote": "免费开玩 · 腾讯运营，内购道具",
  "checkedAt": "2026-10-28",
  "linkHealth": "ok",
  "note": "人工整理：不在 Steam 上的热门免费游戏，链接到官方网站 / 官方商店页",
  "createdAt": "2026-10-28",
  "updatedAt": "2026-10-28",
  "publishStatus": "published",
  "claimNoteEn": "Free to play · run by Tencent; in-game purchases"
}
